{
  "apiVersion": "genesis.network/v1",
  "kind": "Area",
  "metadata": {
    "areaId": "GEN-AREA-001",
    "name": "Genesis Lobby"
  },
  "repository": {
    "provider": "github",
    "owner": "Believers-common-group",
    "repo": "The-believers-lobby"
  },
  "admission": {
    "wardenRequired": true
  },
  "identity": {
    "digitalMe": "supported"
  },
  "lobby": {
    "visible": true,
    "guestAccess": true
  },
  "assistance": {
    "enabled": true,
    "adapter": "lineme",
    "whatsapp": true
  },
  "orchestration": {
    "provider": "synnergyze"
  },
  "evidence": {
    "provider": "river",
    "required": true
  }
}